Microsoft Windows [Version 10.0.26200.7628]
(c) Microsoft Corporation. All rights reserved.

C:\Users\sahil>cd ..

C:\Users>cd ..

C:\>cd xampp

C:\xampp>cd mysql

C:\xampp\mysql>cd bin

C:\xampp\mysql\bin>mysql -u root -p;
ERROR 1045 (28000): Access denied for user 'root'@'localhost' (using password: YES)

C:\xampp\mysql\bin>mysql -u root -p
Enter password:
Welcome to the MariaDB monitor.  Commands end with ; or \g.
Your MariaDB connection id is 9
Server version: 10.4.32-MariaDB mariadb.org binary distribution

Copyright (c) 2000, 2018, Oracle, MariaDB Corporation Ab and others.

Type 'help;' or '\h' for help. Type '\c' to clear the current input statement.

MariaDB [(none)]> CREATE DATABASE select_type;
Query OK, 1 row affected (0.008 sec)

MariaDB [(none)]> use select_type
Database changed
MariaDB [select_type]> USE select_type
Database changed
MariaDB [select_type]> CREATE TABLE employee(id INTEGER,name VARCHAR(20),salary INTEGER,joinDate DATE,address VARCHAR(20));
Query OK, 0 rows affected (0.060 sec)

MariaDB [select_type]> INSERT INTO employee VALUES(1,"SAHIL AGRAWAL",20000,2026-01-15,"BIRTAMODE"),(2,"DHAIRYA AGRAWAL",358092,2026-01-15,"BIRTAMODE"),(3,"NAYAN PATHAK",37589273,2026-01-15,"BIRTAMODE");
Query OK, 3 rows affected, 3 warnings (0.103 sec)
Records: 3  Duplicates: 0  Warnings: 3

MariaDB [select_type]> SELECT name FROM employee WHERE salary>20000;
+-----------------+
| name            |
+-----------------+
| DHAIRYA AGRAWAL |
| NAYAN PATHAK    |
+-----------------+
2 rows in set (0.001 sec)

MariaDB [select_type]> SELECT id FROM employee WHERE date="2026-01-16";
ERROR 1054 (42S22): Unknown column 'date' in 'where clause'
MariaDB [select_type]> SELECT id FROM employee WHERE joinDate="2026-01-16";
Empty set (0.001 sec)

MariaDB [select_type]> SELECT id FROM employee WHERE joinDate="2026-01-15";
Empty set (0.001 sec)

MariaDB [select_type]> SELECT id FROM employee WHERE joinDate=2026-01-15;
+------+
| id   |
+------+
|    1 |
|    2 |
|    3 |
+------+
3 rows in set, 1 warning (0.001 sec)

MariaDB [select_type]> INSERT INTO employee VALUES(4,"ERIC AGRAWAL",20000,"2026-01-16","BIRTAMODE"),(5,"VINAYAK AGRAWAL",358092,"2026-01-16","BIRTAMODE"),(6,"MAYANK PATHAK",37589273,"2026-01-16","BIRTAMODE");
Query OK, 3 rows affected (0.008 sec)
Records: 3  Duplicates: 0  Warnings: 0

MariaDB [select_type]>USE datatype








Microsoft Windows [Version 10.0.26200.7628]
(c) Microsoft Corporation. All rights reserved.

C:\Users\sahil>cd..

C:\Users>cd ..

C:\>cd xampp

C:\xampp>cd mysql

C:\xampp\mysql>cd bin

C:\xampp\mysql\bin>mysql -u root -p
Enter password:
Welcome to the MariaDB monitor.  Commands end with ; or \g.
Your MariaDB connection id is 8
Server version: 10.4.32-MariaDB mariadb.org binary distribution

Copyright (c) 2000, 2018, Oracle, MariaDB Corporation Ab and others.

Type 'help;' or '\h' for help. Type '\c' to clear the current input statement.

MariaDB [(none)]> SHOW DATABASES;
+--------------------+
| Database           |
+--------------------+
| datatype           |
| exam               |
| information_schema |
| mysql              |
| performance_schema |
| phpmyadmin         |
| select_type        |
| test               |
+--------------------+
8 rows in set (0.084 sec)

MariaDB [(none)]> USE seclect_type
ERROR 1049 (42000): Unknown database 'seclect_type'
MariaDB [(none)]> USE select_type
Database changed
MariaDB [select_type]> SHOW tables;
+-----------------------+
| Tables_in_select_type |
+-----------------------+
| employee              |
+-----------------------+
1 row in set (0.001 sec)

MariaDB [select_type]> CREATE TABLE second_employee(id INTEGER AUTO_INCREMENT PRIMARY KEY,name VARCHAR(20),address VARCHAR(20),is_active BOOLEAN,salary INTEGER);
Query OK, 0 rows affected (0.020 sec)

MariaDB [select_type]> INSERT INTO second_employee VALUES (1,"SAHIL AGRAWAL","BIRTAMODE",true,20000),(2,"NAYAN PATHAK","BIRTAMODE",true,14500),(3,"DHAIRYA AGRAWAL","DHULABARI",false,40000),(4,"MAYANK BINDAL","PAKISTAN",false,1769),(5,"SAHIL AGRAWAL","BIRTAMODE",true,20000);
Query OK, 5 rows affected (0.100 sec)
Records: 5  Duplicates: 0  Warnings: 0

MariaDB [select_type]> SELECT DISTINCT name,address from second_employee;
+-----------------+-----------+
| name            | address   |
+-----------------+-----------+
| SAHIL AGRAWAL   | BIRTAMODE |
| NAYAN PATHAK    | BIRTAMODE |
| DHAIRYA AGRAWAL | DHULABARI |
| MAYANK BINDAL   | PAKISTAN  |
+-----------------+-----------+
4 rows in set (0.001 sec)

MariaDB [select_type]> SELECT name,salary from second_employee WHERE salary between 10000 OR 20000;
ERROR 1064 (42000): You have an error in your SQL syntax; check the manual that corresponds to your MariaDB server version for the right syntax to use near 'OR 20000' at line 1
MariaDB [select_type]> SELECT name,salary FROM second_employee WHERE salary between 10000 OR 20000;
ERROR 1064 (42000): You have an error in your SQL syntax; check the manual that corresponds to your MariaDB server version for the right syntax to use near 'OR 20000' at line 1
MariaDB [select_type]> SELECT name from second_employee where salary between 10000 and 20000;
+---------------+
| name          |
+---------------+
| SAHIL AGRAWAL |
| NAYAN PATHAK  |
| SAHIL AGRAWAL |
+---------------+
3 rows in set (0.001 sec)

MariaDB [select_type]> SELECT name from second_employee where salary between 10000 or 20000;
ERROR 1064 (42000): You have an error in your SQL syntax; check the manual that corresponds to your MariaDB server version for the right syntax to use near 'or 20000' at line 1
MariaDB [select_type]> SELECT name from second_employee where salary not between 10000 or 20000;
ERROR 1064 (42000): You have an error in your SQL syntax; check the manual that corresponds to your MariaDB server version for the right syntax to use near 'or 20000' at line 1
MariaDB [select_type]> SELECT name from second_employee where salary not between 10000 and 20000;
+-----------------+
| name            |
+-----------------+
| DHAIRYA AGRAWAL |
| MAYANK BINDAL   |
+-----------------+
2 rows in set (0.001 sec)

MariaDB [select_type]> SELECT name from second_employee where address IN ("BIRTAMODE","PAKISTAN");
+---------------+
| name          |
+---------------+
| SAHIL AGRAWAL |
| NAYAN PATHAK  |
| MAYANK BINDAL |
| SAHIL AGRAWAL |
+---------------+
4 rows in set (0.001 sec)

MariaDB [select_type]> SELECT name from second_employee where address NOT IN ("BIRTAMODE","PAKISTAN");
+-----------------+
| name            |
+-----------------+
| DHAIRYA AGRAWAL |
+-----------------+
1 row in set (0.001 sec)

MariaDB [select_type]> ALTER TABLE second_employee ADD department VARCHAR(20);
Query OK, 0 rows affected (0.015 sec)
Records: 0  Duplicates: 0  Warnings: 0

MariaDB [select_type]> INSERT INTO second_employee(department) VALUES("IT");
Query OK, 1 row affected (0.004 sec)

MariaDB [select_type]> UPDATE second_employee set department="SCIENCE" WHERE id=1;
Query OK, 1 row affected (0.009 sec)
Rows matched: 1  Changed: 1  Warnings: 0

MariaDB [select_type]> CREATE TABLE third_employee (e_id INTEGER AUTO_INCREMENT PRIMARY KEY,name VARCHAR(20),department VARCHAR(20),age INTEGER,salary INTEGER, city VARCHAR(20));
Query OK, 0 rows affected (0.035 sec)

MariaDB [select_type]> DESCRIBE third_employee;
+------------+-------------+------+-----+---------+----------------+
| Field      | Type        | Null | Key | Default | Extra          |
+------------+-------------+------+-----+---------+----------------+
| e_id       | int(11)     | NO   | PRI | NULL    | auto_increment |
| name       | varchar(20) | YES  |     | NULL    |                |
| department | varchar(20) | YES  |     | NULL    |                |
| age        | int(11)     | YES  |     | NULL    |                |
| salary     | int(11)     | YES  |     | NULL    |                |
| city       | varchar(20) | YES  |     | NULL    |                |
+------------+-------------+------+-----+---------+----------------+
6 rows in set (0.039 sec)

MariaDB [select_type]> INSER INTO third_employee(name,department,age,salary,city) VALUES("SAHIL AGRAWAL","SCIENCE",15,20000,"BIRTAMODE"),("DHAIRYA AGRAWAL","SCIENCE",16,25868,"NEPALGUNJ"),("NAYAN PATHAK","FIANACE",22,73498,"BIRATNAGAR"),("RAM AGRAWAL","TEACHING",57,59730,"SILIGURI"),("SITA PODHAR","DELHI",22,73589,"MUMBAI"),("MAHEK MADESHI","UNEMPLOYED",24,79874,"JANAKPUR"),("HARI RAJBANSHI","FINANCE",36,57845,"INDORE"),("LAXAM NEPAL","SCIENCE",57,89540,"JANAKPUR"),("RAJ INDIA","SCIENCE",46,78593,"KOLKATA"),("HARISH UPRETE","FINANCE",38,89468,"NEPALGUNJ");
ERROR 1064 (42000): You have an error in your SQL syntax; check the manual that corresponds to your MariaDB server version for the right syntax to use near 'INSER INTO third_employee(name,department,age,salary,city) VALUES("SAHIL AGRA...' at line 1
MariaDB [select_type]> DESCRIBE third_employee;
+------------+-------------+------+-----+---------+----------------+
| Field      | Type        | Null | Key | Default | Extra          |
+------------+-------------+------+-----+---------+----------------+
| e_id       | int(11)     | NO   | PRI | NULL    | auto_increment |
| name       | varchar(20) | YES  |     | NULL    |                |
| department | varchar(20) | YES  |     | NULL    |                |
| age        | int(11)     | YES  |     | NULL    |                |
| salary     | int(11)     | YES  |     | NULL    |                |
| city       | varchar(20) | YES  |     | NULL    |                |
+------------+-------------+------+-----+---------+----------------+
6 rows in set (0.041 sec)

MariaDB [select_type]> INSERT INTO third_employee(name,department,age,salary,city) VALUES("SAHIL AGRAWAL","SCIENCE",15,20000,"BIRTAMODE"),("DHAIRYA AGRAWAL","SCIENCE",16,25868,"NEPALGUNJ"),("NAYAN PATHAK","FIANACE",22,73498,"BIRATNAGAR"),("RAM AGRAWAL","TEACHING",57,59730,"SILIGURI"),("SITA PODHAR","DELHI",22,73589,"MUMBAI"),("MAHEK MADESHI","UNEMPLOYED",24,79874,"JANAKPUR"),("HARI RAJBANSHI","FINANCE",36,57845,"INDORE"),("LAXAM NEPAL","SCIENCE",57,89540,"JANAKPUR"),("RAJ INDIA","SCIENCE",46,78593,"KOLKATA"),("HARISH UPRETE","FINANCE",38,89468,"NEPALGUNJ");
Query OK, 10 rows affected (0.009 sec)
Records: 10  Duplicates: 0  Warnings: 0

MariaDB [select_type]> SELECT name,id,salary,age,city FROM third_employee WHERE salary between 30000 and 60000 and city IN("NEPALJUNJ","JANAKPUR") and department IN("IT","FINANCE");
ERROR 1054 (42S22): Unknown column 'id' in 'field list'
MariaDB [select_type]> SELECT name,e_id,salary,age,city FROM third_employee WHERE salary between 30000 and 60000 and city IN("NEPALJUNJ","JANAKPUR") and department IN("IT","FINANCE");
Empty set (0.001 sec)

MariaDB [select_type]> SELECT name,e_id,salary,age,city FROM third_employee WHERE salary between 30000 and 100000 and city IN("NEPALJUNJ","JANAKPUR") and department IN("IT","FINANCE");
Empty set (0.001 sec)

MariaDB [select_type]> SELECT name,e_id,salary,age,city FROM third_employee WHERE salary between 30000 and 100000 and city IN("NEPALJUNJ","JANAKPUR") and department IN("SCIENCE","FINANCE");
+-------------+------+--------+------+----------+
| name        | e_id | salary | age  | city     |
+-------------+------+--------+------+----------+
| LAXAM NEPAL |    8 |  89540 |   57 | JANAKPUR |
+-------------+------+--------+------+----------+
1 row in set (0.001 sec)

MariaDB [select_type]> SELECT * FROM third_employee WHERE department NOT IN ("DELHI","FINANCE") AND salary NOT BETWEEN 30000 and 60000;
+------+-----------------+------------+------+--------+------------+
| e_id | name            | department | age  | salary | city       |
+------+-----------------+------------+------+--------+------------+
|    1 | SAHIL AGRAWAL   | SCIENCE    |   15 |  20000 | BIRTAMODE  |
|    2 | DHAIRYA AGRAWAL | SCIENCE    |   16 |  25868 | NEPALGUNJ  |
|    3 | NAYAN PATHAK    | FIANACE    |   22 |  73498 | BIRATNAGAR |
|    6 | MAHEK MADESHI   | UNEMPLOYED |   24 |  79874 | JANAKPUR   |
|    8 | LAXAM NEPAL     | SCIENCE    |   57 |  89540 | JANAKPUR   |
|    9 | RAJ INDIA       | SCIENCE    |   46 |  78593 | KOLKATA    |
+------+-----------------+------------+------+--------+------------+
6 rows in set (0.001 sec)


maria DB








Microsoft Windows [Version 10.0.26200.7628]
(c) Microsoft Corporation. All rights reserved.

C:\Users\sahil>cd ..

C:\Users>cd ..

C:\>cd xampp

C:\xampp>cd mysql

C:\xampp\mysql>cd bin

C:\xampp\mysql\bin>mysql -u root -p
Enter password:
Welcome to the MariaDB monitor.  Commands end with ; or \g.
Your MariaDB connection id is 8
Server version: 10.4.32-MariaDB mariadb.org binary distribution

Copyright (c) 2000, 2018, Oracle, MariaDB Corporation Ab and others.

Type 'help;' or '\h' for help. Type '\c' to clear the current input statement.

MariaDB [(none)]> DHOW DATABASES:
    ->
    -> ;
ERROR 1064 (42000): You have an error in your SQL syntax; check the manual that corresponds to your MariaDB server version for the right syntax to use near 'DHOW DATABASES:' at line 1
MariaDB [(none)]> SHOW DATABASES;
+--------------------+
| Database           |
+--------------------+
| datatype           |
| exam               |
| information_schema |
| mysql              |
| performance_schema |
| phpmyadmin         |
| select_type        |
| test               |
+--------------------+
8 rows in set (0.047 sec)

MariaDB [(none)]> USE select_type;
Database changed
MariaDB [select_type]> SHOW TABLES;
+-----------------------+
| Tables_in_select_type |
+-----------------------+
| employee              |
| second_employee       |
| third_employee        |
+-----------------------+
3 rows in set (0.002 sec)

MariaDB [select_type]> DESCRIBE third_employee;
+------------+-------------+------+-----+---------+----------------+
| Field      | Type        | Null | Key | Default | Extra          |
+------------+-------------+------+-----+---------+----------------+
| e_id       | int(11)     | NO   | PRI | NULL    | auto_increment |
| name       | varchar(20) | YES  |     | NULL    |                |
| department | varchar(20) | YES  |     | NULL    |                |
| age        | int(11)     | YES  |     | NULL    |                |
| salary     | int(11)     | YES  |     | NULL    |                |
| city       | varchar(20) | YES  |     | NULL    |                |
+------------+-------------+------+-----+---------+----------------+
6 rows in set (0.048 sec)

MariaDB [select_type]> SELECT name,salary,city FROM third_employee WHERE salary BETWEEN 20000 and 100000 and city IN("NEPALJUNG","JANAKPUR" and department IN("SCIENCE","FINANCE"));
+-----------------+--------+------------+
| name            | salary | city       |
+-----------------+--------+------------+
| SAHIL AGRAWAL   |  20000 | BIRTAMODE  |
| DHAIRYA AGRAWAL |  25868 | NEPALGUNJ  |
| NAYAN PATHAK    |  73498 | BIRATNAGAR |
| RAM AGRAWAL     |  59730 | SILIGURI   |
| SITA PODHAR     |  73589 | MUMBAI     |
| MAHEK MADESHI   |  79874 | JANAKPUR   |
| HARI RAJBANSHI  |  57845 | INDORE     |
| LAXAM NEPAL     |  89540 | JANAKPUR   |
| RAJ INDIA       |  78593 | KOLKATA    |
| HARISH UPRETE   |  89468 | NEPALGUNJ  |
+-----------------+--------+------------+
10 rows in set, 24 warnings (0.001 sec)

MariaDB [select_type]>  SELECT name,e_id,salary,age,city FROM third_employee WHERE salary between 30000 and 100000 and city IN("NEPALJUNJ","JANAKPUR") and department IN("SCIENCE","FINANCE");
+-------------+------+--------+------+----------+
| name        | e_id | salary | age  | city     |
+-------------+------+--------+------+----------+
| LAXAM NEPAL |    8 |  89540 |   57 | JANAKPUR |
+-------------+------+--------+------+----------+
1 row in set (0.001 sec)

MariaDB [select_type]>  SELECT name,salary,city FROM third_employee WHERE salary between 10000 and 100000 and city IN("NEPALGUNJ","JANAKPUR") and department IN("SCIENCE","FINANCE");
+-----------------+--------+-----------+
| name            | salary | city      |
+-----------------+--------+-----------+
| DHAIRYA AGRAWAL |  25868 | NEPALGUNJ |
| LAXAM NEPAL     |  89540 | JANAKPUR  |
| HARISH UPRETE   |  89468 | NEPALGUNJ |
+-----------------+--------+-----------+
3 rows in set (0.001 sec)

MariaDB [select_type]> SELECT name,salary,city FROM third_employee WHERE department NOT IN(")
    "> SELECT name,salary,city FROM third_employee WHERE department NOT IN(");
+-----------------+--------+------------+
| name            | salary | city       |
+-----------------+--------+------------+
| SAHIL AGRAWAL   |  20000 | BIRTAMODE  |
| DHAIRYA AGRAWAL |  25868 | NEPALGUNJ  |
| NAYAN PATHAK    |  73498 | BIRATNAGAR |
| RAM AGRAWAL     |  59730 | SILIGURI   |
| SITA PODHAR     |  73589 | MUMBAI     |
| MAHEK MADESHI   |  79874 | JANAKPUR   |
| HARI RAJBANSHI  |  57845 | INDORE     |
| LAXAM NEPAL     |  89540 | JANAKPUR   |
| RAJ INDIA       |  78593 | KOLKATA    |
| HARISH UPRETE   |  89468 | NEPALGUNJ  |
+-----------------+--------+------------+
10 rows in set (0.001 sec)

MariaDB [select_type]> SELECT name,salary,city FROM third_employee WHERE department NOT IN("SCIENCE","FINANCE") AND salary NOT BETWEEN 25000 and 75000;
+---------------+--------+----------+
| name          | salary | city     |
+---------------+--------+----------+
| MAHEK MADESHI |  79874 | JANAKPUR |
+---------------+--------+----------+
1 row in set (0.001 sec)

MariaDB [select_type]> SELECT * FROM third_employee WHERE age BETWEEN 25 and 40 AND salary>30000;
+------+----------------+------------+------+--------+-----------+
| e_id | name           | department | age  | salary | city      |
+------+----------------+------------+------+--------+-----------+
|    7 | HARI RAJBANSHI | FINANCE    |   36 |  57845 | INDORE    |
|   10 | HARISH UPRETE  | FINANCE    |   38 |  89468 | NEPALGUNJ |
+------+----------------+------------+------+--------+-----------+
2 rows in set (0.006 sec)

MariaDB [select_type]> SELECT * FROM third_employee WHERE city NOT IN("JANAKPUR") AND salary BETWEEN 20000 and 80000 AND department NOT IN("FINANCE");
+------+-----------------+------------+------+--------+------------+
| e_id | name            | department | age  | salary | city       |
+------+-----------------+------------+------+--------+------------+
|    1 | SAHIL AGRAWAL   | SCIENCE    |   15 |  20000 | BIRTAMODE  |
|    2 | DHAIRYA AGRAWAL | SCIENCE    |   16 |  25868 | NEPALGUNJ  |
|    3 | NAYAN PATHAK    | FIANACE    |   22 |  73498 | BIRATNAGAR |
|    4 | RAM AGRAWAL     | TEACHING   |   57 |  59730 | SILIGURI   |
|    5 | SITA PODHAR     | DELHI      |   22 |  73589 | MUMBAI     |
|    9 | RAJ INDIA       | SCIENCE    |   46 |  78593 | KOLKATA    |
+------+-----------------+------------+------+--------+------------+
6 rows in set (0.002 sec)

MariaDB [select_type]> SELECT * FROM third_employee WHERE department IN("SCIENCE") AND salary BETWEEN 50000 and 80000 OR age BETWEEN 40 and 80;
+------+-------------+------------+------+--------+----------+
| e_id | name        | department | age  | salary | city     |
+------+-------------+------------+------+--------+----------+
|    4 | RAM AGRAWAL | TEACHING   |   57 |  59730 | SILIGURI |
|    8 | LAXAM NEPAL | SCIENCE    |   57 |  89540 | JANAKPUR |
|    9 | RAJ INDIA   | SCIENCE    |   46 |  78593 | KOLKATA  |
+------+-------------+------------+------+--------+----------+
3 rows in set (0.001 sec)

MariaDB [select_type]> SELECT * FROM third_employee WHERE department IN("SCIENCE") AND (salary BETWEEN 50000 and 80000 OR age BETWEEN 40 and 80);
+------+-------------+------------+------+--------+----------+
| e_id | name        | department | age  | salary | city     |
+------+-------------+------------+------+--------+----------+
|    8 | LAXAM NEPAL | SCIENCE    |   57 |  89540 | JANAKPUR |
|    9 | RAJ INDIA   | SCIENCE    |   46 |  78593 | KOLKATA  |
+------+-------------+------------+------+--------+----------+
2 rows in set (0.001 sec)

MariaDB [select_type]> SELECT * FROM third_employe WHERE salary IN(89540,78593,57847,89468)AND city NOT IN("JANAKPUR","NEPALGUNJ");
ERROR 1146 (42S02): Table 'select_type.third_employe' doesn't exist
MariaDB [select_type]> SELECT * FROM third_employee WHERE salary IN(89540,78593,57847,89468)AND city NOT IN("JANAKPUR","NEPALGUNJ");
+------+-----------+------------+------+--------+---------+
| e_id | name      | department | age  | salary | city    |
+------+-----------+------------+------+--------+---------+
|    9 | RAJ INDIA | SCIENCE    |   46 |  78593 | KOLKATA |
+------+-----------+------------+------+--------+---------+
1 row in set (0.001 sec)

MariaDB [select_type]> SELECT * FROM third_employee WHERE department IN("SCIENCE","FINANCE") AND age BETWEEN 40 and 80 AND city IN("JANAKPUR"));
ERROR 1064 (42000): You have an error in your SQL syntax; check the manual that corresponds to your MariaDB server version for the right syntax to use near ')' at line 1
MariaDB [select_type]> SELECT * FROM third_employee WHERE department IN("SCIENCE","FINANCE") AND age NOT BETWEEN 40 and 80 AND city IN("JANAKPUR"));
ERROR 1064 (42000): You have an error in your SQL syntax; check the manual that corresponds to your MariaDB server version for the right syntax to use near ')' at line 1
MariaDB [select_type]> SELECT * FROM third_employee WHERE department IN("SCIENCE","FINANCE") AND age NOT BETWEEN 40 and 80 AND city IN("JANAKPUR"));Ctrl-C -- exit!
Bye

C:\xampp\mysql\bin>

C:\xampp\mysql\bin>mysql -u root -p
Enter password:
Welcome to the MariaDB monitor.  Commands end with ; or \g.
Your MariaDB connection id is 37
Server version: 10.4.32-MariaDB mariadb.org binary distribution

Copyright (c) 2000, 2018, Oracle, MariaDB Corporation Ab and others.

Type 'help;' or '\h' for help. Type '\c' to clear the current input statement.

MariaDB [(none)]> USE select_type;
Database changed
MariaDB [select_type]> SELECT * FROM third_employee WHERE department IN("SCIENCE","FINANCE") AND age NOT BETWEEN 40 and 80 AND city IN("JANAKPUR"));
ERROR 1064 (42000): You have an error in your SQL syntax; check the manual that corresponds to your MariaDB server version for the right syntax to use near ')' at line 1
MariaDB [select_type]> SELECT * FROM third_employee WHERE department IN("SCIENCE","FINANCE") AND age NOT BETWEEN 40 and 80 AND city IN("JANAKPUR");
Empty set (0.001 sec)

MariaDB [select_type]> SELECT * FROM third_employee WHERE department IN("SCIENCE","FINANCE") AND age NOT BETWEEN 40 and 50 AND city IN("JANAKPUR");
+------+-------------+------------+------+--------+----------+
| e_id | name        | department | age  | salary | city     |
+------+-------------+------------+------+--------+----------+
|    8 | LAXAM NEPAL | SCIENCE    |   57 |  89540 | JANAKPUR |
+------+-------------+------------+------+--------+----------+
1 row in set (0.001 sec)

MariaDB [select_type]> SELECT name,department FROM third_employee WHERE salary BETWEEN 35000 and 70000 AND department NOT IN("SCIENCE")";
    "> ;
    ">
    ">
    ">  SELECT * FROM third_employee WHERE department IN("SCIENCE","FINANCE") AND age NOT BETWEEN 40 and 80 AND city IN("JANAKPUR"));
    ">  SELECT * FROM third_employee WHERE department IN("SCIENCE","FINANCE") AND age NOT BETWEEN 40 and 80 AND city IN("JANAKPUR"));\]
    "> SELECT name,department FROM third_employee WHERE salary BETWEEN 35000 and 70000 AND department NOT IN("SCIENCE")";
ERROR 1064 (42000): You have an error in your SQL syntax; check the manual that corresponds to your MariaDB server version for the right syntax to use near '";
;


 SELECT * FROM third_employee WHERE department IN("SCIENCE","FINANCE")...' at line 1
MariaDB [select_type]> SELECT name,department FROM third_employee WHERE salary BETWEEN 35000 and 70000 AND department NOT IN("SCIENCE")";
    "> k
    "> kklokm;
    "> kklokm;
    ">  SELECT * FROM third_employee WHERE department IN("SCIENCE","FINANCE") AND age NOT BETWEEN 40 and 80 AND city IN("JANAKPUR"));\]
    "> ;
    ">
    ">
    ">
    ">
    ">
    ">  SELECT * FROM third_employee WHERE department IN("SCIENCE","FINANCE") AND age NOT BETWEEN 40 and 80 AND city IN("JANAKPUR"));
    "> SELECT name,department FROM third_employee WHERE salary BETWEEN 35000 and 70000 AND department NOT IN("SCIENCE");
    "> ;
    ">
    "> 4
    ">
    ">
    "> USE select_type;
    "> SELECT name,salary,city FROM third_employee WHERE department NOT IN(");
ERROR 1064 (42000): You have an error in your SQL syntax; check the manual that corresponds to your MariaDB server version for the right syntax to use near '";
k
kklokm;
kklokm;
 SELECT * FROM third_employee WHERE department IN("SCIEN...' at line 1
MariaDB [select_type]> SELECT name,department FROM third_employee WHERE salary BETWEEN 35000 and 70000 AND department NOT IN("SCIENCE");
+----------------+------------+
| name           | department |
+----------------+------------+
| RAM AGRAWAL    | TEACHING   |
| HARI RAJBANSHI | FINANCE    |
+----------------+------------+
2 rows in set (0.001 sec)

MariaDB [select_type]> SELECT * from third_employee WHERE salary BETWEEN 30000 and 80000 AND department IN("SCIENCE") AND city NOT IN("JANAKPUR");
+------+-----------+------------+------+--------+---------+
| e_id | name      | department | age  | salary | city    |
+------+-----------+------------+------+--------+---------+
|    9 | RAJ INDIA | SCIENCE    |   46 |  78593 | KOLKATA |
+------+-----------+------------+------+--------+---------+
1 row in set (0.001 sec)

MariaDB [select_type]> SELECT * FROM third_employee WHERE (salary BETWEEN 40000 and 80000 OR age BETWEEN 40 and 80) AND department NOT IN("SCIENCE","FINANCE") AND CITY IN("NEPLAJUNG","JANKPUR");
Empty set (0.001 sec)

MariaDB [select_type]> SELECT * FROM third_employee WHERE (salary BETWEEN 40000 and 80000 OR age BETWEEN 40 and 80) AND department NOT IN("UNEMPLOYED","FINANCE") AND CITY IN("NEPLAJUNG","JANKPUR");
Empty set (0.002 sec)

MariaDB [select_type]> SELECT * FROM third_employee WHERE (salary BETWEEN 40000 and 80000 OR age BETWEEN 40 and 80) AND department NOT IN("UNEMPLOYED","FINANCE") AND CITY IN("NEPLAJUNG","SILIGURI");
+------+-------------+------------+------+--------+----------+
| e_id | name        | department | age  | salary | city     |
+------+-------------+------------+------+--------+----------+
|    4 | RAM AGRAWAL | TEACHING   |   57 |  59730 | SILIGURI |
+------+-------------+------------+------+--------+----------+
1 row in set (0.001 sec)

MariaDB [select_type]>
MariaDB
slecet *










Microsoft Windows [Version 10.0.26200.7705]
(c) Microsoft Corporation. All rights reserved.

C:\Users\sahil>c d..
'c' is not recognized as an internal or external command,
operable program or batch file.

C:\Users\sahil>cd ..

C:\Users>cd ..

C:\>cd xampp

C:\xampp>cd mysql

C:\xampp\mysql>cd bin

C:\xampp\mysql\bin>mysql -u root -n;
mysql: unknown option '-;'

C:\xampp\mysql\bin>mysql -u root -p
Enter password:
Welcome to the MariaDB monitor.  Commands end with ; or \g.
Your MariaDB connection id is 8
Server version: 10.4.32-MariaDB mariadb.org binary distribution

Copyright (c) 2000, 2018, Oracle, MariaDB Corporation Ab and others.

Type 'help;' or '\h' for help. Type '\c' to clear the current input statement.

MariaDB [(none)]> SHOW DATABASES;
+--------------------+
| Database           |
+--------------------+
| datatype           |
| exam               |
| information_schema |
| mysql              |
| performance_schema |
| phpmyadmin         |
| select_type        |
| test               |
+--------------------+
8 rows in set (0.094 sec)

MariaDB [(none)]> USE select_type;
Database changed
MariaDB [select_type]> CREATE TABLE (id INTEGER AUTO_INCREMENT PRIMARY KEY,name VARCHAR(20),address VARCHAR(20),class INTEGER,isMARRIED BOLLEAN);
ERROR 1064 (42000): You have an error in your SQL syntax; check the manual that corresponds to your MariaDB server version for the right syntax to use near '(id INTEGER AUTO_INCREMENT PRIMARY KEY,name VARCHAR(20),address VARCHAR(20),c...' at line 1
MariaDB [select_type]> CREATE TABLE fourth_select(id INTEGER AUTO_INCREMENT PRIMARY KEY,name VARCHAR(20),address VARCHAR(20),class INTEGER,isMARRIED BOLLEAN);
ERROR 1064 (42000): You have an error in your SQL syntax; check the manual that corresponds to your MariaDB server version for the right syntax to use near ')' at line 1
MariaDB [select_type]> CREATE TABLE fourth_select(id INTEGER AUTO_INCREMENT PRIMARY KEY,name VARCHAR(20),address VARCHAR(20),class INTEGER,isMARRIED BOOLEAN);
Query OK, 0 rows affected (0.019 sec)

MariaDB [select_type]> INSERT name,address,class,isMARRIED INTO fourth_select VALUES("SAHIL AGRAWAL","BIRTAMODE",10,0),("NAYAN PAHTAK","BIRTAMODE",15,1);
ERROR 1064 (42000): You have an error in your SQL syntax; check the manual that corresponds to your MariaDB server version for the right syntax to use near 'address,class,isMARRIED INTO fourth_select VALUES("SAHIL AGRAWAL","BIRTAMODE"...' at line 1
MariaDB [select_type]> INSERT INTO fourth_select (name,address,class,isMARRIED) VALUES("SAHIL AGRAWAL","BIRTAMODE",10,0),("NAYAN PAHTAK","BIRTAMODE",15,1);
Query OK, 2 rows affected (0.087 sec)
Records: 2  Duplicates: 0  Warnings: 0

MariaDB [select_type]> SELECT * from fouth_select;
ERROR 1146 (42S02): Table 'select_type.fouth_select' doesn't exist
MariaDB [select_type]> SELECT * from fourth_select;
+----+---------------+-----------+-------+-----------+
| id | name          | address   | class | isMARRIED |
+----+---------------+-----------+-------+-----------+
|  1 | SAHIL AGRAWAL | BIRTAMODE |    10 |         0 |
|  2 | NAYAN PAHTAK  | BIRTAMODE |    15 |         1 |
+----+---------------+-----------+-------+-----------+
2 rows in set (0.001 sec)

MariaDB [select_type]> SELECT address FROM fourth_select WHERE address LIKE 'B%';
+-----------+
| address   |
+-----------+
| BIRTAMODE |
| BIRTAMODE |
+-----------+
2 rows in set (0.001 sec)

MariaDB [select_type]> SELECT address FROM fourth_select WHERE address LIKE '%E';
+-----------+
| address   |
+-----------+
| BIRTAMODE |
| BIRTAMODE |
+-----------+
2 rows in set (0.001 sec)

MariaDB [select_type]> SELECT address FROM fourth_select WHERE address LIKE 'B%E';
+-----------+
| address   |
+-----------+
| BIRTAMODE |
| BIRTAMODE |
+-----------+
2 rows in set (0.001 sec)

MariaDB [select_type]> SELECT name FROM fourth_select WHERE name LIKE 'S%';
+---------------+
| name          |
+---------------+
| SAHIL AGRAWAL |
+---------------+
1 row in set (0.001 sec)

MariaDB [select_type]> SELECT name FROM fourth_select WHERE name LIKE '_____';
Empty set (0.001 sec)

MariaDB [select_type]> SELECT name FROM fourth_select WHERE name LIKE '____________';
+--------------+
| name         |
+--------------+
| NAYAN PAHTAK |
+--------------+
1 row in set (0.001 sec)

MariaDB [select_type]> SELECT name FROM fourth_select WHERE name LIKE '_____________';
+---------------+
| name          |
+---------------+
| SAHIL AGRAWAL |
+---------------+
1 row in set (0.001 sec)

MariaDB [select_type]> SELECT name FROM fourth_select WHERE name LIKE '%HIL%';
+---------------+
| name          |
+---------------+
| SAHIL AGRAWAL |
+---------------+
1 row in set (0.001 sec)

MariaDB [select_type]> SELECT name FROM fourth_select WHERE name LIKE '%LAG%';
Empty set (0.001 sec)

MariaDB [select_type]> SELECT name FROM fourth_select WHERE name LIKE '%L AG%';
+---------------+
| name          |
+---------------+
| SAHIL AGRAWAL |
+---------------+
1 row in set (0.001 sec)

MariaDB [select_type]> SELECT name FROM fourth_select WHERE name LIKE 'S%' AND name LIKE '_____________';
+---------------+
| name          |
+---------------+
| SAHIL AGRAWAL |
+---------------+
1 row in set (0.001 sec)

MariaDB [select_type]> SELECT name FROM fourth_select WHERE name LIKE 'S% _____________';
Empty set (0.001 sec)

MariaDB [select_type]> SELECT name FROM fourth_select WHERE name LIKE 'S% ____________';
Empty set (0.001 sec)

MariaDB [select_type]> SELECT name FROM fourth_select WHERE name LIKE 'S___________';
Empty set (0.001 sec)

MariaDB [select_type]> SELECT name FROM fourth_select WHERE name LIKE 'S___________';
Empty set (0.001 sec)

MariaDB [select_type]> SELECT name FROM fourth_select WHERE name LIKE 'S____________';
+---------------+
| name          |
+---------------+
| SAHIL AGRAWAL |
+---------------+
1 row in set (0.001 sec)

MariaDB [select_type]> SELECT name FROM fourth_select WHERE name LIKE '%A%';
+---------------+
| name          |
+---------------+
| SAHIL AGRAWAL |
| NAYAN PAHTAK  |
+---------------+
2 rows in set (0.001 sec)

MariaDB [select_type]> SELECT * from fourth_select;
+----+---------------+-----------+-------+-----------+
| id | name          | address   | class | isMARRIED |
+----+---------------+-----------+-------+-----------+
|  1 | SAHIL AGRAWAL | BIRTAMODE |    10 |         0 |
|  2 | NAYAN PAHTAK  | BIRTAMODE |    15 |         1 |
+----+---------------+-----------+-------+-----------+
2 rows in set (0.001 sec)

MariaDB [select_type]> SELECT address FROM fourth_select;
+-----------+
| address   |
+-----------+
| BIRTAMODE |
| BIRTAMODE |
+-----------+
2 rows in set (0.001 sec)

MariaDB [select_type]> SELECT address FROM fourth_select WHERE LIKE '%I%';
ERROR 1064 (42000): You have an error in your SQL syntax; check the manual that corresponds to your MariaDB server version for the right syntax to use near 'LIKE '%I%'' at line 1
MariaDB [select_type]> SELECT address FROM fourth_select WHERE address LIKE '%I%';
+-----------+
| address   |
+-----------+
| BIRTAMODE |
| BIRTAMODE |
+-----------+
2 rows in set (0.001 sec)

MariaDB [select_type]> SELECT address FROM fourth_select WHERE address LIKE '_I%';
+-----------+
| address   |
+-----------+
| BIRTAMODE |
| BIRTAMODE |
+-----------+
2 rows in set (0.001 sec)

MariaDB [select_type]> INSERT INTO fourth_select(name,address,class,isMARRIED) VALUES("DHAIRYA","NEPALJUNG",58,0),("ROAHN","JANAKPUR",52,1);
Query OK, 2 rows affected (0.009 sec)
Records: 2  Duplicates: 0  Warnings: 0

MariaDB [select_type]> SELECT * FROM fourth_select;
+----+---------------+-----------+-------+-----------+
| id | name          | address   | class | isMARRIED |
+----+---------------+-----------+-------+-----------+
|  1 | SAHIL AGRAWAL | BIRTAMODE |    10 |         0 |
|  2 | NAYAN PAHTAK  | BIRTAMODE |    15 |         1 |
|  3 | DHAIRYA       | NEPALJUNG |    58 |         0 |
|  4 | ROAHN         | JANAKPUR  |    52 |         1 |
+----+---------------+-----------+-------+-----------+
4 rows in set (0.001 sec)

MariaDB [select_type]> SELECT address FROM fourth_select WHERE address LIKE 'J%';
+----------+
| address  |
+----------+
| JANAKPUR |
+----------+
1 row in set (0.001 sec)

MariaDB [select_type]> SELECT address FROM fourth_select WHERE address LIKE '_A%';
+----------+
| address  |
+----------+
| JANAKPUR |
+----------+
1 row in set (0.001 sec)

MariaDB [select_type]> SELECT address FROM fourth_select WHERE address LIKE '____k%';
+----------+
| address  |
+----------+
| JANAKPUR |
+----------+
1 row in set (0.001 sec)

MariaDB [select_type]> SELECT address FROM fourth_select WHERE address LIKE '%__P';
Empty set (0.001 sec)

MariaDB [select_type]> SELECT address FROM fourth_select WHERE address LIKE '%P__';
+----------+
| address  |
+----------+
| JANAKPUR |
+----------+
1 row in set (0.001 sec)








🟠 LEVEL 3 – AGGREGATE FUNCTIONS (ONLY ONE AT A TIME)

Find the maximum age of students.

Find the minimum age of students.

Find the total sum of student ages.

Find the average age of students.

Find the maximum roll number.

Find the minimum roll number.

Find the average roll number.

Find the sum of all roll numbers.

🔵 LEVEL 4 – SIMPLE AGGREGATE WITH NO CONDITIONS

(Still legal for beginners)

Find the maximum age value present in the table.

Find the minimum age value present in the table.

Find the average age value present in the table.

Find the total number of years (sum of age) of all students.

Find the largest student ID.

Find the smallest student ID.

Find the average student ID.








Microsoft Windows [Version 10.0.26200.7705]
(c) Microsoft Corporation. All rights reserved.

C:\Users\sahil>cd ..

C:\Users>cd ..

C:\>cd xampp

C:\xampp>cd mysql

C:\xampp\mysql>cd bin

C:\xampp\mysql\bin>mysql -u root -p
Enter password:
Welcome to the MariaDB monitor.  Commands end with ; or \g.
Your MariaDB connection id is 8
Server version: 10.4.32-MariaDB mariadb.org binary distribution

Copyright (c) 2000, 2018, Oracle, MariaDB Corporation Ab and others.

Type 'help;' or '\h' for help. Type '\c' to clear the current input statement.

MariaDB [(none)]> USE select_type
Database changed
MariaDB [select_type]> CREATE TABLE taskone_select(name VARCHAR(20),age INTEGER,roll number INTEGER,address VARCHAR(20));
ERROR 1064 (42000): You have an error in your SQL syntax; check the manual that corresponds to your MariaDB server version for the right syntax to use near 'INTEGER,address VARCHAR(20))' at line 1
MariaDB [select_type]> CREATE TABLE taskone_select(name VARCHAR(20),age INTEGER,roll_number INTEGER,address VARCHAR(20));
Query OK, 0 rows affected (0.019 sec)

MariaDB [select_type]> INSERT INTO(name, age , roll_number,address) VALUES("SAHIL AGRAWAL",15,20,"BIRTAMODE"),("DHAIRYA AGRAWAL",16,12,"BIRTAMODE"),("NAYAN PATHAK",22,25,"BIRTABAZAR"),("RAJ TAMANG",28,44,"KAKARVITTA");
ERROR 1064 (42000): You have an error in your SQL syntax; check the manual that corresponds to your MariaDB server version for the right syntax to use near '(name, age , roll_number,address) VALUES("SAHIL AGRAWAL",15,20,"BIRTAMODE"),(...' at line 1
MariaDB [select_type]> INSERT INTO(name,age,roll_number,address) VALUES("SAHIL AGRAWAL",15,20,"BIRTAMODE"),("DHAIRYA AGRAWAL",16,12,"BIRTAMODE"),("NAYAN PATHAK",22,25,"BIRTABAZAR"),("RAJ TAMANG",28,44,"KAKARVITTA");
ERROR 1064 (42000): You have an error in your SQL syntax; check the manual that corresponds to your MariaDB server version for the right syntax to use near '(name,age,roll_number,address) VALUES("SAHIL AGRAWAL",15,20,"BIRTAMODE"),("DH...' at line 1
MariaDB [select_type]> INSERT INTO taskone_select(name,age,roll_number,address) VALUES("SAHIL AGRAWAL",15,20,"BIRTAMODE"),("DHAIRYA AGRAWAL",16,12,"BIRTAMODE"),("NAYAN PATHAK",22,25,"BIRTABAZAR"),("RAJ TAMANG",28,44,"KAKARVITTA");
Query OK, 4 rows affected (0.061 sec)
Records: 4  Duplicates: 0  Warnings: 0

MariaDB [select_type]> SELECT max(age) as "MAXIMUM AGE" from taskone_select;
+-------------+
| MAXIMUM AGE |
+-------------+
|          28 |
+-------------+
1 row in set (0.001 sec)

MariaDB [select_type]> SELECT min(age) as "MINIMUM AGE" from taskone_select;
+-------------+
| MINIMUM AGE |
+-------------+
|          15 |
+-------------+
1 row in set (0.001 sec)

MariaDB [select_type]> SELECT sum(age) as "SUM AGE" from taskone_select;
+---------+
| SUM AGE |
+---------+
|      81 |
+---------+
1 row in set (0.001 sec)

MariaDB [select_type]> SELECT avg(age) as "AVERAGE AGE" from taskone_select;
+-------------+
| AVERAGE AGE |
+-------------+
|     20.2500 |
+-------------+
1 row in set (0.001 sec)

MariaDB [select_type]> SELECT max(roll_number) as "MAXIMUM ROLL NUMBER" from taskone_select;
+---------------------+
| MAXIMUM ROLL NUMBER |
+---------------------+
|                  44 |
+---------------------+
1 row in set (0.001 sec)

MariaDB [select_type]> SELECT min(roll_number) as "MINIMUM ROLL NUMBER" from taskone_select;
+---------------------+
| MINIMUM ROLL NUMBER |
+---------------------+
|                  12 |
+---------------------+
1 row in set (0.000 sec)

MariaDB [select_type]> SELECT avg(roll_number) as "AVERAGE ROLL NUMBER" from taskone_select;
+---------------------+
| AVERAGE ROLL NUMBER |
+---------------------+
|             25.2500 |
+---------------------+
1 row in set (0.001 sec)

MariaDB [select_type]> SELECT sum(roll_number) as "SUM ROLL NUMBER" from taskone_select;
+-----------------+
| SUM ROLL NUMBER |
+-----------------+
|             101 |
+-----------------+
1 row in set (0.001 sec)

MariaDB [select_type]>









Microsoft Windows [Version 10.0.26200.7705]
(c) Microsoft Corporation. All rights reserved.

C:\Users\sahil>c d..
'c' is not recognized as an internal or external command,
operable program or batch file.

C:\Users\sahil>cd ..

C:\Users>c d.
'c' is not recognized as an internal or external command,
operable program or batch file.

C:\Users>c d..
'c' is not recognized as an internal or external command,
operable program or batch file.

C:\Users>c d..
'c' is not recognized as an internal or external command,
operable program or batch file.

C:\Users>cd ./

C:\Users>cd ..

C:\>cd xampp

C:\xampp>cd mysql

C:\xampp\mysql>cd bin

C:\xampp\mysql\bin>mysql -u root -p
Enter password:
Welcome to the MariaDB monitor.  Commands end with ; or \g.
Your MariaDB connection id is 8
Server version: 10.4.32-MariaDB mariadb.org binary distribution

Copyright (c) 2000, 2018, Oracle, MariaDB Corporation Ab and others.

Type 'help;' or '\h' for help. Type '\c' to clear the current input statement.

MariaDB [(none)]> USE fifth_select;
ERROR 1049 (42000): Unknown database 'fifth_select'
MariaDB [(none)]> USE select_type;
Database changed
MariaDB [select_type]> DESCRIBE fifth_select;
+-------------+-------------+------+-----+---------+-------+
| Field       | Type        | Null | Key | Default | Extra |
+-------------+-------------+------+-----+---------+-------+
| name        | varchar(20) | YES  |     | NULL    |       |
| age         | int(11)     | YES  |     | NULL    |       |
| roll_number | int(11)     | YES  |     | NULL    |       |
| address     | varchar(20) | YES  |     | NULL    |       |
+-------------+-------------+------+-----+---------+-------+
4 rows in set (0.047 sec)

MariaDB [select_type]> INSERT INTO fifht_select(name,age,roll_number,address) VALUES("SAHIL AGRAWAL",15,20,"BIRTAMODE"),("DHAIRYA AGRAWAL",16,12,"BIRTAMODE"),("NAYAN PATHAK",22,25,"BIRTABAZAR"),("RAJ TAMANG",28,44,"KAKARVITTA");
ERROR 1146 (42S02): Table 'select_type.fifht_select' doesn't exist
MariaDB [select_type]> INSERT INTO fifth_select(name,age,roll_number,address) VALUES("SAHIL AGRAWAL",15,20,"BIRTAMODE"),("DHAIRYA AGRAWAL",16,12,"BIRTAMODE"),("NAYAN PATHAK",22,25,"BIRTABAZAR"),("RAJ TAMANG",28,44,"KAKARVITTA");
Query OK, 4 rows affected (0.009 sec)
Records: 4  Duplicates: 0  Warnings: 0

MariaDB [select_type]> SELECT * from fifth_select;
+-----------------+------+-------------+------------+
| name            | age  | roll_number | address    |
+-----------------+------+-------------+------------+
| SAHIL AGRAWAL   |   15 |          20 | BIRTAMODE  |
| DHAIRYA AGRAWAL |   16 |          12 | BIRTAMODE  |
| NAYAN PATHAK    |   22 |          25 | BIRTABAZAR |
| RAJ TAMANG      |   28 |          44 | KAKARVITTA |
+-----------------+------+-------------+------------+
4 rows in set (0.000 sec)

MariaDB [select_type]> SELECT count(age) FROM fifth_select;
+------------+
| count(age) |
+------------+
|          4 |
+------------+
1 row in set (0.001 sec)

MariaDB [select_type]> INSERT INTO fifth_select(age) VALUES(22),(67),(47),(48);
Query OK, 4 rows affected (0.009 sec)
Records: 4  Duplicates: 0  Warnings: 0

MariaDB [select_type]> SELECT count(age) FROM fifth_select;
+------------+
| count(age) |
+------------+
|          8 |
+------------+
1 row in set (0.001 sec)

MariaDB [select_type]> SELECT * FROM fifth_select;
+-----------------+------+-------------+------------+
| name            | age  | roll_number | address    |
+-----------------+------+-------------+------------+
| SAHIL AGRAWAL   |   15 |          20 | BIRTAMODE  |
| DHAIRYA AGRAWAL |   16 |          12 | BIRTAMODE  |
| NAYAN PATHAK    |   22 |          25 | BIRTABAZAR |
| RAJ TAMANG      |   28 |          44 | KAKARVITTA |
| NULL            |   22 |        NULL | NULL       |
| NULL            |   67 |        NULL | NULL       |
| NULL            |   47 |        NULL | NULL       |
| NULL            |   48 |        NULL | NULL       |
+-----------------+------+-------------+------------+
8 rows in set (0.001 sec)

MariaDB [select_type]> SELECT count(age) FROM fifth_select;
+------------+
| count(age) |
+------------+
|          8 |
+------------+
1 row in set (0.001 sec)

MariaDB [select_type]> SELECT count(name) FROM fifth_select;
+-------------+
| count(name) |
+-------------+
|           4 |
+-------------+
1 row in set (0.001 sec)

MariaDB [select_type]> SELECT count(*) FROM fifth_select;
+----------+
| count(*) |
+----------+
|        8 |
+----------+
1 row in set (0.001 sec)

MariaDB [select_type]> select age from fifth_select group by;
ERROR 1064 (42000): You have an error in your SQL syntax; check the manual that corresponds to your MariaDB server version for the right syntax to use near '' at line 1
MariaDB [select_type]> select age from fifth_select age group by;
ERROR 1064 (42000): You have an error in your SQL syntax; check the manual that corresponds to your MariaDB server version for the right syntax to use near '' at line 1
MariaDB [select_type]> select age from fifth_select group by age;
+------+
| age  |
+------+
|   15 |
|   16 |
|   22 |
|   28 |
|   47 |
|   48 |
|   67 |
+------+
7 rows in set (0.001 sec)

MariaDB [select_type]> select age from fifth_select group by age dec;
ERROR 1064 (42000): You have an error in your SQL syntax; check the manual that corresponds to your MariaDB server version for the right syntax to use near 'dec' at line 1
MariaDB [select_type]> select age from fifth_select group by age desc;
+------+
| age  |
+------+
|   67 |
|   48 |
|   47 |
|   28 |
|   22 |
|   16 |
|   15 |
+------+
7 rows in set (0.001 sec)

MariaDB [select_type]> UPDATE fifth_select set name="HIRA AGARWAL" WHERE id=4
    -> ;
ERROR 1054 (42S22): Unknown column 'id' in 'where clause'
MariaDB [select_type]> UPDATE fifth_select set name="HIRA AGARWAL" WHERE age=47;
Query OK, 1 row affected (0.008 sec)
Rows matched: 1  Changed: 1  Warnings: 0

MariaDB [select_type]> SELECT * from fifth_select;
+-----------------+------+-------------+------------+
| name            | age  | roll_number | address    |
+-----------------+------+-------------+------------+
| SAHIL AGRAWAL   |   15 |          20 | BIRTAMODE  |
| DHAIRYA AGRAWAL |   16 |          12 | BIRTAMODE  |
| NAYAN PATHAK    |   22 |          25 | BIRTABAZAR |
| RAJ TAMANG      |   28 |          44 | KAKARVITTA |
| NULL            |   22 |        NULL | NULL       |
| NULL            |   67 |        NULL | NULL       |
| HIRA AGARWAL    |   47 |        NULL | NULL       |
| NULL            |   48 |        NULL | NULL       |
+-----------------+------+-------------+------------+
8 rows in set (0.001 sec)

MariaDB [select_type]> DELETE FROM fifth_select WHERE address="KAKARVITTA";
Query OK, 1 row affected (0.008 sec)

MariaDB [select_type]> SELECT * from fifth_select;
+-----------------+------+-------------+------------+
| name            | age  | roll_number | address    |
+-----------------+------+-------------+------------+
| SAHIL AGRAWAL   |   15 |          20 | BIRTAMODE  |
| DHAIRYA AGRAWAL |   16 |          12 | BIRTAMODE  |
| NAYAN PATHAK    |   22 |          25 | BIRTABAZAR |
| NULL            |   22 |        NULL | NULL       |
| NULL            |   67 |        NULL | NULL       |
| HIRA AGARWAL    |   47 |        NULL | NULL       |
| NULL            |   48 |        NULL | NULL       |
+-----------------+------+-------------+------------+
7 rows in set (0.001 sec)

MariaDB [select_type]> UPDATE fifth_select set name="RAM AGRAWAL",set roll_number=24,set address="KAKARVITTA" WHERE age=22;
ERROR 1064 (42000): You have an error in your SQL syntax; check the manual that corresponds to your MariaDB server version for the right syntax to use near 'set roll_number=24,set address="KAKARVITTA" WHERE age=22' at line 1
MariaDB [select_type]> UPDATE fifth_select set name="RAM AGRAWAL",roll_number=24,address="KAKARVITTA" WHERE age=22;
Query OK, 2 rows affected (0.007 sec)
Rows matched: 2  Changed: 2  Warnings: 0

MariaDB [select_type]> SELECT * from fifth_select;
+-----------------+------+-------------+------------+
| name            | age  | roll_number | address    |
+-----------------+------+-------------+------------+
| SAHIL AGRAWAL   |   15 |          20 | BIRTAMODE  |
| DHAIRYA AGRAWAL |   16 |          12 | BIRTAMODE  |
| RAM AGRAWAL     |   22 |          24 | KAKARVITTA |
| RAM AGRAWAL     |   22 |          24 | KAKARVITTA |
| NULL            |   67 |        NULL | NULL       |
| HIRA AGARWAL    |   47 |        NULL | NULL       |
| NULL            |   48 |        NULL | NULL       |
+-----------------+------+-------------+------------+
7 rows in set (0.000 sec)

MariaDB [select_type]> UPDATE fifth_select set name="SITA BASNET",roll_number=14,address="CHARPENE" WHERE age=67;
Query OK, 1 row affected (0.008 sec)
Rows matched: 1  Changed: 1  Warnings: 0

MariaDB [select_type]> UPDATE fifth_select set name="HAIR KAKRKI",roll_number=04,address="ITTABHATTA" WHERE age=48;
Query OK, 1 row affected (0.007 sec)
Rows matched: 1  Changed: 1  Warnings: 0

MariaDB [select_type]> SELECT * from fifth_select;
+-----------------+------+-------------+------------+
| name            | age  | roll_number | address    |
+-----------------+------+-------------+------------+
| SAHIL AGRAWAL   |   15 |          20 | BIRTAMODE  |
| DHAIRYA AGRAWAL |   16 |          12 | BIRTAMODE  |
| RAM AGRAWAL     |   22 |          24 | KAKARVITTA |
| RAM AGRAWAL     |   22 |          24 | KAKARVITTA |
| SITA BASNET     |   67 |          14 | CHARPENE   |
| HIRA AGARWAL    |   47 |        NULL | NULL       |
| HAIR KAKRKI     |   48 |           4 | ITTABHATTA |
+-----------------+------+-------------+------------+
7 rows in set (0.000 sec)

MariaDB [select_type]> UPDATE fifth_select set roll_number=14,address="SURANGA" WHERE age=47;
Query OK, 1 row affected (0.008 sec)
Rows matched: 1  Changed: 1  Warnings: 0

MariaDB [select_type]> SELECT * from fifth_select;
+-----------------+------+-------------+------------+
| name            | age  | roll_number | address    |
+-----------------+------+-------------+------------+
| SAHIL AGRAWAL   |   15 |          20 | BIRTAMODE  |
| DHAIRYA AGRAWAL |   16 |          12 | BIRTAMODE  |
| RAM AGRAWAL     |   22 |          24 | KAKARVITTA |
| RAM AGRAWAL     |   22 |          24 | KAKARVITTA |
| SITA BASNET     |   67 |          14 | CHARPENE   |
| HIRA AGARWAL    |   47 |          14 | SURANGA    |
| HAIR KAKRKI     |   48 |           4 | ITTABHATTA |
+-----------------+------+-------------+------------+
7 rows in set (0.001 sec)

MariaDB [select_type]>
MariaDB [select_type]>







Microsoft Windows [Version 10.0.26200.7705]
(c) Microsoft Corporation. All rights reserved.

C:\Users\sahil>cd ..

C:\Users>cd ..

C:\>cd xampp

C:\xampp>cd mysql

C:\xampp\mysql>cd bin
gi taa
C:\xampp\mysql\bin>mysql -u root -p
Enter password:
Welcome to the MariaDB monitor.  Commands end with ; or \g.
Your MariaDB connection id is 8
Server version: 10.4.32-MariaDB mariadb.org binary distribution

Copyright (c) 2000, 2018, Oracle, MariaDB Corporation Ab and others.

Type 'help;' or '\h' for help. Type '\c' to clear the current input statement.

MariaDB [(none)]> use select_type
Database changed







MariaDB
Database
MariaDB
Database









Microsoft Windows [Version 10.0.26200.7840]
(c) Microsoft Corporation. All rights reserved.

C:\Users\sahil>cd ..

C:\Users>cd ..

C:\>cd xampp

C:\xampp>cd mysql

C:\xampp\mysql>cd bin

C:\xampp\mysql\bin>mysql -u root -p
Enter password:
Welcome to the MariaDB monitor.  Commands end with ; or \g.
Your MariaDB connection id is 8
Server version: 10.4.32-MariaDB mariadb.org binary distribution

Copyright (c) 2000, 2018, Oracle, MariaDB Corporation Ab and others.

Type 'help;' or '\h' for help. Type '\c' to clear the current input statement.

MariaDB [(none)]> show databases;
+--------------------+
| Database           |
+--------------------+
| datatype           |
| exam               |
| information_schema |
| mysql              |
| performance_schema |
| phpmyadmin         |
| select_type        |
| test               |
+--------------------+
8 rows in set (0.089 sec)

MariaDB [(none)]> USE datatype;
Database changed
MariaDB [datatype]> show coloumns;
ERROR 1064 (42000): You have an error in your SQL syntax; check the manual that corresponds to your MariaDB server version for the right syntax to use near 'coloumns' at line 1
MariaDB [datatype]> show tables;
+----------------------+
| Tables_in_datatype   |
+----------------------+
| autoincrenement_type |
| bollen_type          |
| datetime_type        |
| enum_type            |
| json_type            |
| point_type           |
| text_type            |
+----------------------+
7 rows in set (0.001 sec)

MariaDB [datatype]> CREATE TABLE null_values(s_id PRIMARY KEY AUTO_INCREMENT,s_name VARCHAR(20),s_address VARCHAR(20),s_faculty VARCHAR(20));
ERROR 1064 (42000): You have an error in your SQL syntax; check the manual that corresponds to your MariaDB server version for the right syntax to use near 'PRIMARY KEY AUTO_INCREMENT,s_name VARCHAR(20),s_address VARCHAR(20),s_faculty...' at line 1
MariaDB [datatype]> CREATE TABLE null_values(s_id PRIMARY KEY AUTO_INCREMENT,s_name VARCHAR(20),s_address VARCHAR(20),s_faculty VARCHAR(20));
ERROR 1064 (42000): You have an error in your SQL syntax; check the manual that corresponds to your MariaDB server version for the right syntax to use near 'PRIMARY KEY AUTO_INCREMENT,s_name VARCHAR(20),s_address VARCHAR(20),s_faculty...' at line 1
MariaDB [datatype]> CREATE TABLE null_values(s_id INTEGER PRIMARY KEY AUTO_INCREMENT,s_name VARCHAR(20),s_address VARCHAR(20),s_faculty VARCHAR(20));
Query OK, 0 rows affected (0.021 sec)

MariaDB [datatype]> INSERT INTO null_values("SHAIL AGRAWAL","BIRTAMODE","SCIENCE"),("NAYAN PATRHAK",null,"BIOLOGY"),("DHAIRYA AGRAWAL","BAHDRAPUR","SCIENCE"),("ROHAN BAJAJ",null,"SOFTWARE"),("MAYANK BINDAL","KAKARVITTA","COMMERCE");
ERROR 1064 (42000): You have an error in your SQL syntax; check the manual that corresponds to your MariaDB server version for the right syntax to use near '"SHAIL AGRAWAL","BIRTAMODE","SCIENCE"),("NAYAN PATRHAK",null,"BIOLOGY"),("DHA...' at line 1
MariaDB [datatype]> INSERT INTO null_values VALUES("SHAIL AGRAWAL","BIRTAMODE","SCIENCE"),("NAYAN PATRHAK",null,"BIOLOGY"),("DHAIRYA AGRAWAL","BAHDRAPUR","SCIENCE"),("ROHAN BAJAJ",null,"SOFTWARE"),("MAYANK BINDAL","KAKARVITTA","COMMERCE");
ERROR 1136 (21S01): Column count doesn't match value count at row 1
MariaDB [datatype]> INSERT INTO null_values(s_name,s_address,s_faculty) VALUES("SHAIL AGRAWAL","BIRTAMODE","SCIENCE"),("NAYAN PATRHAK",null,"BIOLOGY"),("DHAIRYA AGRAWAL","BAHDRAPUR","SCIENCE"),("ROHAN BAJAJ",null,"SOFTWARE"),("MAYANK BINDAL","KAKARVITTA","COMMERCE");
Query OK, 5 rows affected (0.009 sec)
Records: 5  Duplicates: 0  Warnings: 0

MariaDB [datatype]> SELECT * FROM null_values;
+------+-----------------+------------+-----------+
| s_id | s_name          | s_address  | s_faculty |
+------+-----------------+------------+-----------+
|    1 | SHAIL AGRAWAL   | BIRTAMODE  | SCIENCE   |
|    2 | NAYAN PATRHAK   | NULL       | BIOLOGY   |
|    3 | DHAIRYA AGRAWAL | BAHDRAPUR  | SCIENCE   |
|    4 | ROHAN BAJAJ     | NULL       | SOFTWARE  |
|    5 | MAYANK BINDAL   | KAKARVITTA | COMMERCE  |
+------+-----------------+------------+-----------+
5 rows in set (0.001 sec)

MariaDB [datatype]> SELECT * FROM null_values WHERE s_address is null;
+------+---------------+-----------+-----------+
| s_id | s_name        | s_address | s_faculty |
+------+---------------+-----------+-----------+
|    2 | NAYAN PATRHAK | NULL      | BIOLOGY   |
|    4 | ROHAN BAJAJ   | NULL      | SOFTWARE  |
+------+---------------+-----------+-----------+
2 rows in set (0.001 sec)

MariaDB [datatype]> UPDATE null_values SET s_address=null WHERE s_id=3;
Query OK, 1 row affected (0.010 sec)
Rows matched: 1  Changed: 1  Warnings: 0

MariaDB [datatype]> SELECT * FROM null_values;
+------+-----------------+------------+-----------+
| s_id | s_name          | s_address  | s_faculty |
+------+-----------------+------------+-----------+
|    1 | SHAIL AGRAWAL   | BIRTAMODE  | SCIENCE   |
|    2 | NAYAN PATRHAK   | NULL       | BIOLOGY   |
|    3 | DHAIRYA AGRAWAL | NULL       | SCIENCE   |
|    4 | ROHAN BAJAJ     | NULL       | SOFTWARE  |
|    5 | MAYANK BINDAL   | KAKARVITTA | COMMERCE  |
+------+-----------------+------------+-----------+
5 rows in set (0.001 sec)

MariaDB [datatype]> SELECT * FROM null_values WHERE s_address is null;
+------+-----------------+-----------+-----------+
| s_id | s_name          | s_address | s_faculty |
+------+-----------------+-----------+-----------+
|    2 | NAYAN PATRHAK   | NULL      | BIOLOGY   |
|    3 | DHAIRYA AGRAWAL | NULL      | SCIENCE   |
|    4 | ROHAN BAJAJ     | NULL      | SOFTWARE  |
+------+-----------------+-----------+-----------+
3 rows in set (0.001 sec)

MariaDB [datatype]> SELECT * FROM null_values WHERE s_address is not null;
+------+---------------+------------+-----------+
| s_id | s_name        | s_address  | s_faculty |
+------+---------------+------------+-----------+
|    1 | SHAIL AGRAWAL | BIRTAMODE  | SCIENCE   |
|    5 | MAYANK BINDAL | KAKARVITTA | COMMERCE  |
+------+---------------+------------+-----------+
2 rows in set (0.001 sec)

MariaDB [datatype]> CREATE TABLE students (
    ->     s_id INT PRIMARY KEY,
    ->     s_name VARCHAR(100),
    ->     s_address VARCHAR(150),
    ->     s_roll INT,
    ->     a_age INT,
    ->     s_house VARCHAR(20),
    ->     s_hobby VARCHAR(50),
    ->     s_scholarship INT
    -> );
Query OK, 0 rows affected (0.027 sec)

MariaDB [datatype]> INSERT INTO students
    -> (s_id, s_name, s_address, s_roll, a_age, s_house, s_hobby, s_scholarship)
    -> VALUES
    -> (1, 'Rahul Sharma', 'Delhi', 101, 18, 'Red', 'Cricket', 15000),
    -> (2, 'Ananya Verma', 'Mumbai', 102, 19, 'Blue', 'Painting', 20000),
    -> (3, 'Arjun Patel', 'Ahmedabad', 103, 20, 'Green', 'Football', 12000),
    -> (4, 'Sneha Kapoor', 'Delhi', 104, 18, 'Yellow', 'Dancing', 18000),
    -> (5, 'Rahul Mehta', 'Pune', 105, 21, 'Red', 'Reading', NULL),
    -> (6, 'Ishita Roy', 'Kolkata', 106, 19, 'Blue', 'Music', 25000),
    -> (7, 'Karan Singh', 'Jaipur', 107, 22, 'Green', 'Swimming', 30000),
    -> (8, 'Priya Nair', 'Chennai', 108, 20, 'Yellow', 'Cooking', 22000),
    -> (9, 'Aditya Rao', 'Hyderabad', 109, 21, 'Red', 'Photography', 5000),
    -> (10, 'Neha Joshi', 'Lucknow', 110, 18, 'Blue', 'Writing', NULL),
    -> (11, 'Vikram Desai', 'Surat', 111, 23, 'Green', 'Cycling', 40000),
    -> (12, 'Aman Gupta', 'Bhopal', 112, 19, 'Yellow', 'Gaming', 10000),
    -> (13, 'Ananya Iyer', 'Bengaluru', 113, 20, 'Red', 'Painting', 27000),
    -> (14, 'Rohan Das', 'Patna', 114, 22, 'Blue', 'Cricket', 35000),
    -> (15, 'Simran Kaur', 'Chandigarh', 115, 18, 'Green', NULL, 45000);
Query OK, 15 rows affected (0.017 sec)
Records: 15  Duplicates: 0  Warnings: 0

MariaDB [datatype]> SELECT * FROM students;
+------+--------------+------------+--------+-------+---------+-------------+---------------+
| s_id | s_name       | s_address  | s_roll | a_age | s_house | s_hobby     | s_scholarship |
+------+--------------+------------+--------+-------+---------+-------------+---------------+
|    1 | Rahul Sharma | Delhi      |    101 |    18 | Red     | Cricket     |         15000 |
|    2 | Ananya Verma | Mumbai     |    102 |    19 | Blue    | Painting    |         20000 |
|    3 | Arjun Patel  | Ahmedabad  |    103 |    20 | Green   | Football    |         12000 |
|    4 | Sneha Kapoor | Delhi      |    104 |    18 | Yellow  | Dancing     |         18000 |
|    5 | Rahul Mehta  | Pune       |    105 |    21 | Red     | Reading     |          NULL |
|    6 | Ishita Roy   | Kolkata    |    106 |    19 | Blue    | Music       |         25000 |
|    7 | Karan Singh  | Jaipur     |    107 |    22 | Green   | Swimming    |         30000 |
|    8 | Priya Nair   | Chennai    |    108 |    20 | Yellow  | Cooking     |         22000 |
|    9 | Aditya Rao   | Hyderabad  |    109 |    21 | Red     | Photography |          5000 |
|   10 | Neha Joshi   | Lucknow    |    110 |    18 | Blue    | Writing     |          NULL |
|   11 | Vikram Desai | Surat      |    111 |    23 | Green   | Cycling     |         40000 |
|   12 | Aman Gupta   | Bhopal     |    112 |    19 | Yellow  | Gaming      |         10000 |
|   13 | Ananya Iyer  | Bengaluru  |    113 |    20 | Red     | Painting    |         27000 |
|   14 | Rohan Das    | Patna      |    114 |    22 | Blue    | Cricket     |         35000 |
|   15 | Simran Kaur  | Chandigarh |    115 |    18 | Green   | NULL        |         45000 |
+------+--------------+------------+--------+-------+---------+-------------+---------------+
15 rows in set (0.001 sec)

MariaDB [datatype]> UPDATE students set WHERE red=raato;
ERROR 1064 (42000): You have an error in your SQL syntax; check the manual that corresponds to your MariaDB server version for the right syntax to use near 'WHERE red=raato' at line 1
MariaDB [datatype]> UPDATE students set s_house="raato" WHERE s_house="red";
Query OK, 4 rows affected (0.010 sec)
Rows matched: 4  Changed: 4  Warnings: 0

MariaDB [datatype]> UPDATE students set WHERE red=raato;
ERROR 1064 (42000): You have an error in your SQL syntax; check the manual that corresponds to your MariaDB server version for the right syntax to use near 'WHERE red=raato' at line 1
MariaDB [datatype]> SELECT * FROM students;
+------+--------------+------------+--------+-------+---------+-------------+---------------+
| s_id | s_name       | s_address  | s_roll | a_age | s_house | s_hobby     | s_scholarship |
+------+--------------+------------+--------+-------+---------+-------------+---------------+
|    1 | Rahul Sharma | Delhi      |    101 |    18 | raato   | Cricket     |         15000 |
|    2 | Ananya Verma | Mumbai     |    102 |    19 | Blue    | Painting    |         20000 |
|    3 | Arjun Patel  | Ahmedabad  |    103 |    20 | Green   | Football    |         12000 |
|    4 | Sneha Kapoor | Delhi      |    104 |    18 | Yellow  | Dancing     |         18000 |
|    5 | Rahul Mehta  | Pune       |    105 |    21 | raato   | Reading     |          NULL |
|    6 | Ishita Roy   | Kolkata    |    106 |    19 | Blue    | Music       |         25000 |
|    7 | Karan Singh  | Jaipur     |    107 |    22 | Green   | Swimming    |         30000 |
|    8 | Priya Nair   | Chennai    |    108 |    20 | Yellow  | Cooking     |         22000 |
|    9 | Aditya Rao   | Hyderabad  |    109 |    21 | raato   | Photography |          5000 |
|   10 | Neha Joshi   | Lucknow    |    110 |    18 | Blue    | Writing     |          NULL |
|   11 | Vikram Desai | Surat      |    111 |    23 | Green   | Cycling     |         40000 |
|   12 | Aman Gupta   | Bhopal     |    112 |    19 | Yellow  | Gaming      |         10000 |
|   13 | Ananya Iyer  | Bengaluru  |    113 |    20 | raato   | Painting    |         27000 |
|   14 | Rohan Das    | Patna      |    114 |    22 | Blue    | Cricket     |         35000 |
|   15 | Simran Kaur  | Chandigarh |    115 |    18 | Green   | NULL        |         45000 |
+------+--------------+------------+--------+-------+---------+-------------+---------------+
15 rows in set (0.001 sec)

MariaDB [datatype]> UPDATE students set="Silligri" WHERE id=6;
ERROR 1064 (42000): You have an error in your SQL syntax; check the manual that corresponds to your MariaDB server version for the right syntax to use near '="Silligri" WHERE id=6' at line 1
MariaDB [datatype]> UPDATE students set s_address="Silligri" WHERE id=6;
ERROR 1054 (42S22): Unknown column 'id' in 'where clause'
MariaDB [datatype]> UPDATE students set s_address="Silligri" WHERE s_id=6;
Query OK, 1 row affected (0.010 sec)
Rows matched: 1  Changed: 1  Warnings: 0

MariaDB [datatype]> SELECT * FROM students;
+------+--------------+------------+--------+-------+---------+-------------+---------------+
| s_id | s_name       | s_address  | s_roll | a_age | s_house | s_hobby     | s_scholarship |
+------+--------------+------------+--------+-------+---------+-------------+---------------+
|    1 | Rahul Sharma | Delhi      |    101 |    18 | raato   | Cricket     |         15000 |
|    2 | Ananya Verma | Mumbai     |    102 |    19 | Blue    | Painting    |         20000 |
|    3 | Arjun Patel  | Ahmedabad  |    103 |    20 | Green   | Football    |         12000 |
|    4 | Sneha Kapoor | Delhi      |    104 |    18 | Yellow  | Dancing     |         18000 |
|    5 | Rahul Mehta  | Pune       |    105 |    21 | raato   | Reading     |          NULL |
|    6 | Ishita Roy   | Silligri   |    106 |    19 | Blue    | Music       |         25000 |
|    7 | Karan Singh  | Jaipur     |    107 |    22 | Green   | Swimming    |         30000 |
|    8 | Priya Nair   | Chennai    |    108 |    20 | Yellow  | Cooking     |         22000 |
|    9 | Aditya Rao   | Hyderabad  |    109 |    21 | raato   | Photography |          5000 |
|   10 | Neha Joshi   | Lucknow    |    110 |    18 | Blue    | Writing     |          NULL |
|   11 | Vikram Desai | Surat      |    111 |    23 | Green   | Cycling     |         40000 |
|   12 | Aman Gupta   | Bhopal     |    112 |    19 | Yellow  | Gaming      |         10000 |
|   13 | Ananya Iyer  | Bengaluru  |    113 |    20 | raato   | Painting    |         27000 |
|   14 | Rohan Das    | Patna      |    114 |    22 | Blue    | Cricket     |         35000 |
|   15 | Simran Kaur  | Chandigarh |    115 |    18 | Green   | NULL        |         45000 |
+------+--------------+------------+--------+-------+---------+-------------+---------------+
15 rows in set (0.001 sec)

MariaDB [datatype]> UPDATE students set s_roll=s_roll+4;
Query OK, 15 rows affected (0.009 sec)
Rows matched: 15  Changed: 15  Warnings: 0

MariaDB [datatype]> SELECT * FROM students;
+------+--------------+------------+--------+-------+---------+-------------+---------------+
| s_id | s_name       | s_address  | s_roll | a_age | s_house | s_hobby     | s_scholarship |
+------+--------------+------------+--------+-------+---------+-------------+---------------+
|    1 | Rahul Sharma | Delhi      |    105 |    18 | raato   | Cricket     |         15000 |
|    2 | Ananya Verma | Mumbai     |    106 |    19 | Blue    | Painting    |         20000 |
|    3 | Arjun Patel  | Ahmedabad  |    107 |    20 | Green   | Football    |         12000 |
|    4 | Sneha Kapoor | Delhi      |    108 |    18 | Yellow  | Dancing     |         18000 |
|    5 | Rahul Mehta  | Pune       |    109 |    21 | raato   | Reading     |          NULL |
|    6 | Ishita Roy   | Silligri   |    110 |    19 | Blue    | Music       |         25000 |
|    7 | Karan Singh  | Jaipur     |    111 |    22 | Green   | Swimming    |         30000 |
|    8 | Priya Nair   | Chennai    |    112 |    20 | Yellow  | Cooking     |         22000 |
|    9 | Aditya Rao   | Hyderabad  |    113 |    21 | raato   | Photography |          5000 |
|   10 | Neha Joshi   | Lucknow    |    114 |    18 | Blue    | Writing     |          NULL |
|   11 | Vikram Desai | Surat      |    115 |    23 | Green   | Cycling     |         40000 |
|   12 | Aman Gupta   | Bhopal     |    116 |    19 | Yellow  | Gaming      |         10000 |
|   13 | Ananya Iyer  | Bengaluru  |    117 |    20 | raato   | Painting    |         27000 |
|   14 | Rohan Das    | Patna      |    118 |    22 | Blue    | Cricket     |         35000 |
|   15 | Simran Kaur  | Chandigarh |    119 |    18 | Green   | NULL        |         45000 |
+------+--------------+------------+--------+-------+---------+-------------+---------------+
15 rows in set (0.003 sec)

MariaDB [datatype]> UPDATE students set s_scholarship=s_scholarship+((5/100)*s_scholarship) WHERE s_scholarship<20000;
Query OK, 5 rows affected (0.009 sec)
Rows matched: 5  Changed: 5  Warnings: 0

MariaDB [datatype]> SELECT * FROM students;
+------+--------------+------------+--------+-------+---------+-------------+---------------+
| s_id | s_name       | s_address  | s_roll | a_age | s_house | s_hobby     | s_scholarship |
+------+--------------+------------+--------+-------+---------+-------------+---------------+
|    1 | Rahul Sharma | Delhi      |    105 |    18 | raato   | Cricket     |         15750 |
|    2 | Ananya Verma | Mumbai     |    106 |    19 | Blue    | Painting    |         20000 |
|    3 | Arjun Patel  | Ahmedabad  |    107 |    20 | Green   | Football    |         12600 |
|    4 | Sneha Kapoor | Delhi      |    108 |    18 | Yellow  | Dancing     |         18900 |
|    5 | Rahul Mehta  | Pune       |    109 |    21 | raato   | Reading     |          NULL |
|    6 | Ishita Roy   | Silligri   |    110 |    19 | Blue    | Music       |         25000 |
|    7 | Karan Singh  | Jaipur     |    111 |    22 | Green   | Swimming    |         30000 |
|    8 | Priya Nair   | Chennai    |    112 |    20 | Yellow  | Cooking     |         22000 |
|    9 | Aditya Rao   | Hyderabad  |    113 |    21 | raato   | Photography |          5250 |
|   10 | Neha Joshi   | Lucknow    |    114 |    18 | Blue    | Writing     |          NULL |
|   11 | Vikram Desai | Surat      |    115 |    23 | Green   | Cycling     |         40000 |
|   12 | Aman Gupta   | Bhopal     |    116 |    19 | Yellow  | Gaming      |         10500 |
|   13 | Ananya Iyer  | Bengaluru  |    117 |    20 | raato   | Painting    |         27000 |
|   14 | Rohan Das    | Patna      |    118 |    22 | Blue    | Cricket     |         35000 |
|   15 | Simran Kaur  | Chandigarh |    119 |    18 | Green   | NULL        |         45000 |
+------+--------------+------------+--------+-------+---------+-------------+---------------+
15 rows in set (0.001 sec)

MariaDB [datatype]>



DataBase